star_score,reviews
4,어딜가나 여기만한 곳이 없네요
4,묻지도 따지지도 말고 일단 드셔보세요
4,아이참 나는 그냥 그렇다
4,양갈비 가성비 정말 갓갓 냄새도 하나도 안나고 진짜 맛있어요 부모님 모시고 가도 좋을 듯
3,오리호박
4,로슈슈
3,자주 가는 카페에 옥수수 디저트 생김 화이트 초코와 치즈 케이크 속에 옥수수 알갱이가 박혀있어 옥수수 맛도 은은히 나고 부드럽고 달고 너무 맛있음 이름도 어쩜 로수수니 나는 무조건 라지 사이즈로 먹어야 성이 참
3,커피맛 안봐서 모름
5,지나가다 우연히들렀는데 고기완자랑 쇠고기탕면 득템하고갑니다
4,비빔국수 맛있어요
4,쇠고기탕면 자꾸 생각납니다추천
5,다양한 서비스 와 불맛나는 매운 쭈꾸미 친절한 직원들 모두 좋아요
1,여기 썩은 고기 쓰다 걸려서 덕정점은 문 닫았어요 이런집은 망해야되요가지마세요
3,여자 개불친절
4,규모도 크지만 사람들도 엄청나네요 웨이팅 있어요 맛은 먹을만하고 가성비는 좋네요
3,건물이 깔끔해서 몰랐는데 년이 넘는 중국 음식점이었어요 개인적으로는 여기 간짜장이 맛있어요 그냥 간짜장도 맛있고 해물이 팍팍 들어간 삼선 간짜장도 맛나서 여기 처음 오시면 간짜장은 꼭 맛봐야해요
1,그냥 별로 입니다 음식 퀄리티에 비해 가격이 너무쌤 그리고 반찬 하나 추가할때마다 돈받음
2,진짜 별로였어요
5,설빙보다 얼음에서 우유맛이 진하게 느껴지고 푸짐한데 가격도 착하다 이 동네에서 오래 살아남은 이유가 있는 매장
5,맛있게 불맛나는 쭈꾸미와 친절한 사장님과 종업원 분들의 응대가 인상적인 식당
5,가성비 좋은 동네 맛집 동네 사람들이 자주 가는 맛집 사리 무한리필 친절한 주인장 최고
5,직접만든 두부로 요리 해주시는데 따끈따끈한 두부 간장에 찍어서 한입먹으면 세상 고소 테이블마다 직접짠 들기름이 있는데 간장이랑 두부에 들기름 뿌려먹으면 미친맛 특이 저는 두부튀김이 넘나 맛났어요 앞뒤 바삭하게 구우면 겉은 바삭 안은 부들 존맛탱구리에요 원래 좀 외진곳에 있었는데 요번에 자리를 옮겼다고 하더라구요 저는 옮기기 하루전에 가서 추억의 자리에서 먹었지용 두부먹고 옆에 약수물 한잔 마셔주면 최고였는데 그점은 조금 아쉽네요 
3,그냥 쏘쏘해요 오리훈제를 시켜서 그런건지 모르겠는데 아주 맛있다는 아닙니다 장작구이를 안먹어서 그런지 좋은 평가를 주긴 어렵네요
3, 옹심이메밀칼국수 감자전 메밀전병 인제에 볼 일 보러왔다 가게 된 집 한마디로 정리하면 주연보다 조연이 빛나는 집 감자전과 메밀전병이 갓 나와 뜨근허니 맛있음 옹심이메밀칼국수는 우선 옹심이가 거의 없음 그나마 있는 옹심이 중 몇몇은 딱딱하게 굳은 식감 비빔막국수도 들어간 재료도 거의 없고 메리트도 없는 그저그런맛 제일 중요한 김치가 맛 없음 그냥 가격대비 손님들이 많이 찾아가는 것 같지만 꿀꿀이 입맛엔 로
2,예전 맛이 아니라 실망
3,일본에서 먹은 데판야끼가 계속 생갔났는데 오이시이모노카타리가서 너무 좋았다 한국인의 입맛의 맞게 접목시켜서 깔끔하고 좋았다
3,불고기한상차림을 먹었는데 가격이 저렴하고 양이 푸짐해서 배부르게 먹고 왔어요 그리고 너무 맛있어요
3,회천초등학교에서 정문으로 나와 길을 건너면 위치해 있어서 찾는데 어렵지 않아요
2,양이 푸짐하고 메뉴 주문시 계절에 따라 바뀌는 제철 나물과 여러가지 장아찌가 반찬으로 같이 제공되어 고기와 곁들어 먹으면 맛이 배가 된다
2,가격이 저렴하고 카페 분위기가 너무 마음에 들어서 계속 오는 단골집이예요 낮에 햇살이 잘 들어와서 무척 따뜻해요
3,불고기한상차림이랑 갈비찜한상차림이랑 저렴한 가격에 즐길 수 있어서 좋아요 그리고 주문하면 반찬이 정말 많이 나오는데 다 신선하고 맛있어요
3,아기자기한 소품과 식물들이 화이트배경과 잘 어울려서 카페를 더욱 더 따뜻하게 만들어 주는 것 같다 또한 디저트와 음료도 다양하고 맛있다
3,기사식당이라고 기사분들만 계신게 아니라 가면 일반인분들도 많고 가격이 저렴해서 부담없이 먹을 수 있어요
2,뼈다귀해장국을 시켜먹었는데 뼈다귀가 개 들어있었는데 뼈다귀에 살이 투툼하게 있어서 발라먹기 좋았어요 그리고 직접 담근 김치라서 맛있네요
3,술집 분위기가 정말 좋아요 남자친구랑 자주 가는데 갈떄마다 분위기가 너무 좋아서 분위기에 취하고 술에 취하네요
2,전골을 시켜서 먹었는데 양이 푸짐하고 고기에 살이 두툼하고 냄새가 안나서 먹기 좋았어요 다먹은후에 밥을 비벼먹었는데 맛있게 먹고 왔어요
2,점심시간에 가서 할인된 가격으로 점심특선 스끼야끼를 즐겼는데 푸짐하고 양이 많아서 배부르게 먹고왔어요
2,김치가 맛있어요 깍두기랑 배추김치 두종류 나와서 좋고 고기가 냄새나지 안하서 좋아요
2,덕정주공단지아파트 후문으로 나오면 맛집골목에 위치해 있어요 춘천닭갈비 생각날때 한번씩 가는데 닭이 부드럽고 양념이 맛있어요
3,안주가 맛있고 양도 푸짐하고 분위기가 너무 좋아요 가면 사진을 많이 찍어요 사진 찍으면 예쁘게 나와요
2,닭갈비에 뼈가 없어서 먹는데 불편하지 않았어요 국내산 닭고기라서 믿고 먹을수 있었고 닭이 부드럽고 식감이 좋았어요
3,국내산 닭고기김치쌀을 사용하는 착한식당이서 믿고 가요 모든 식재료들이 신선해서 좋아요
2,저는 이집의 쇠고기탕면을 좋아하는데 다른집 국수랑은 다른 무엇가의 맛이 있어요 고기국수가 고소하고 담백해서 너무 좋네요
3,식당입구에서부터 맛집의 느낌이 팍 난다 나는 쇠고기탕면과 고기완자를 꼭 먹는데 고기가 담백하고 부드럽다
2,부대찌개제육볶음오징어볶음 등 여기메뉴 다 맛있는거 같아요 주인분의 음식솜씨가 매우 좋으세요 그리고 양도 많고 정도 많으세요
2,산지초등학교 근처체 있는 술집이예요 찾아가는데 어렵지 않아요 안주도 맛있고 사장님부부가 엄청 친절하세요
3,부대찌개를 주문해서 먹었는데 양이 정말 많더라고요 가격도 저렴하고 푸짐하게 먹고 왔어요
2,비빔국수의 사용하는 소스가 계절과일을 숙성시켜서 만든 소스라 부드럽고 자극적이지 않아서 좋아요 비빔국수가 맵고 짜고 자극적인곳이 많잔아요
4,잘 먹었습니다
4,잘 먹었습니다
3,두부를 직접 조리를 해서 그런지 두부의 고소한 향이 항상 기부이 좋고 늘 생각납니다
3,한가족이 공동으로 운영하는 두부요리 식당 남편은 농사를 지어 두부를 만들고 아내는 식당을 운영합니다
3,가족이 함께 운영하는 두부 맛집 파주 오현리에서 운영하다가 양주로 옮겨온 두부요리 전문점 입니다
5,아주 좋습니다 다만 가끔가면 맛이 일정하지않고 조금씩 다르다는게 단점 주방장이 자주 바뀌는듯 서울근교에 이만한 막국수집은 없는듯합니다
1,한우간판을 달지말던가 마치한우 전문식당인것처럼 한우라고 써놓고 주력은 미국산 서빙하는 여자는 인상도 숭악하게 생긴게 불친절끝판왕 이런덴 빨리 망해야 좋다는 리뷰는 도데체 머지
3,맛있었던 편이에요 순두부 보리밥은 찬이 함께 나오는데 값이 원이다 반찬은 직접 농사지은 채소로 만들었고 고추장과 들기름도 직접 만들어 쓴다고 합니다
3,직접만든 고소한 두부의 향이 코끝을 맴도는 정말 건강한 맛을 느낄 수 잇는 두부요리 전문점입니다
2,배부르게 먹을 수 있었어요
3,계곡 놀러 갔을 때 추천해요
2,백숙이 너무 부드럽고 맛있습니다
3,가격도 좋고 너무 맛있어요
3,메뉴도 다양하고 맛있었습니다
2,토종닭 백숙은 크기도 크고 너무 맛있었어요
2,야유회나 친목회로 가면 좋을 것 같아요
3,매장도 깔끔하고 좋아요
3,서비스도 친절하고 너무 좋아요
2,양주의 백숙 맛집
2,매운갈비찜이 맛있었어요
4,잘 먹었습니다
2,매장도 너무 깔끔하고 찾기 좋았어요
2,민물매운탕 매콤하고 맛있습니다 추천해요
3,같이 나오는 밑반찬도 다양하고 맛있었습니다
2,쭈꾸미가 너무 맛있습니다
3,매장이 편안한 분위기라 좋아요
2,삼겹살이 너무 맛있어요
2,갈비 맛집이에요 추천합니다
2,돼지갈비 정식이 유명합니다
2,저렴하고 푸짐하게 먹을 수 있어서 좋았습니다
2,토속음식점으로 너무 맛있고 믿을 수 있어요
3,계곡물에 발을 담그고 백숙도 먹을 수 있어서 너무 좋아요
3,백숙도 맛있고 다른 메뉴들도 전부 맛있네요
2,간장게장 무한리필이라 너무 좋았어요
3,갈비가 살살 녹아요 너무 맛있습니다
2,양꼬치가 저렴하고 너무 맛있어요
3,편한 분위기에서 식사할 수 있어서 좋았습니다
2,물 위에 평상이 있어서 시원하고 맛있게 먹을 수 있어요
2,갈비와 함께 시원한 꽃게탕도 너무 맛있습니다
3,코스상차림 푸짐하고 맛있었습니다
2,장흥계곡 놀러갔을때 너무 추천합니다
2,백숙 맛집이에요 추천해요
2,분위기도 너무 좋고 고기도 맛있어요
2,백숙이 너무 푸짐하고 맛있어요
3,화덕피자가 맛있는 집입니다 아밀이란 이름은 아름다운 밀에서 따온거라고 합니다 참으로 예쁘고 정감가는 이름이에요
3,깔끔했던 것 같아요 화덕피자와 파스타 맛도 일품이엿구요 직원분이 정말 상냥하고 친절하셔서 좋았습니다
5,동네라서 한번가봤지만 추천은 아닌거같아요
5,저는 개인적으로 별루네요 차라리 보충대 매운탕집을 추천드립니다
5,처음 가봤는데 고급스럽고 가족연인 괜찮아요 추천드립니다
1,맛은 있어요근데 일단 더이상 가고싶진않아요 배짱장사 친절하지도 않고 그래봐야 벌거 들어간 것도 없는 단순 밀가루 칼국수인데 한 그릇에 천원은 좀 심하지않나요 이것 저것 푸짐하게 온갖 건데기가 다 들어간 해물칼국수가 아닙니다바지락만 들어갔습니다 거기다 반찬으로 나온 무채에 밥비벼먹는데 참기름좀 뿌려주고 천원절대 이런저런 고명이 들어간 보통의 비빔밥이 아닙니다 불쾌해서 더이상 안갑니다 가셔서 원짜리 불쾌함 한번 맛보세요
2,쿠키 만들기 체험을 하고 왔어요 좋았던거 같아요
2,직접 만드는거라서 그런지 엄청 맛나요 특히 라자냐 끝내주더라고요 맘에 들었음
2,화덕피자 맛있는곳을 찾다가 발견한 장흥에있는 이탈리안 레스토랑 아밀 또 가고 싶은 맘이에요
5,적극 추천합니다
5,기대이상이라 만족스러웠어요
5,의정부 배달 불가능한 음식점 배달해드립니다 주문만 해주세요 주문은 카톡 트루미스 친추
5,적극 추천합니다
3,천원 비빔밥은 참기름만넣고 밑반찬으로나온무채랑비벼먹는게천원 아무리장사가잘되도이건아닌듯 정말감동적인맛도아니고 줄서서먹는맛도절대아님 그래도덕정에선 그나마맛집 그래서숫가락개
5,정육식당 인테리어 깔끔하고 한우전문점 식당보다 훨 맛있고 가격착하네요 만족만족 후회없네요
2,갈만했었어요
3,가는길이 힘들엇지만 반려동물과 한번쯤 가보기 좋은곳
5,식당 벽면 문 전체를 다 가려놔서 영업을 안하는 줄 알았는데 아주 작게 영업중이라 써 있어서 들어갔다 국수면발이 굉장히 매끄러웠다 잔치국수 멸치 비린맛이 비빔국수 양념장이 맛이 별로 냉국수 냉면 느낌나면서 제일 맛있었다 부추전 밀가루가 진짜 거의 없어서 정말 좋았다 만두 젓가락으로 못 먹는다 건들면 다 터져버린다 숟가락으로 퍼 먹다가 그냥 포기했다 가까운 곳에 있으면 즐겨 가도 되는 곳 멀리서는
4,모듬생선구이 맛있었어요 쌈밥정식도 맛나요 돌솥밥이 약간 뜸이 덜 들었었지만 대체로 만족해요 재방문 의사 있어요 
5,맛집이라 하기에는 돈가스 맛이 평범하다
2,가격이 조금있었지만 그만큼 맛있었습니당
3,강아지가 뛰어놀곳이 잇어서 넘넘좋앗어용
3,이 동네 사는 친구가 여기 짜장면이 제일 맛있다며 저를 데려가길래 알게 된 가게네요 가격도 요즘 중국집 치고는 저렴한 편인것 같고 저희는 홀에 직접 가서 먹었는데 알고보니 배달도 하시나보더라구요 개인적으로는 고소한 맛이 많이 났던 간짜장이 제일 맛났어요
3,여긴 늘 손님들이 줄을 서서 먹는 곳이라 가보고싶었는데 지난 주말에 다녀오게 됬어요 탕수육 짜장면 짬뽕 이렇게 골고루 주문해서 먹었는데 탕수육 소스가 달달한게 바삭한 튀김이랑 잘 어울렸어요 짜장면도 맛있었지만 개인적으로는 해물이 듬뿍들어가 있는 짬뽕이 더 마음에 들었네요
3,강아지가 전용메뉴를 정말 좋아하더라구요 제가 먹어봐도 맛있었어요
1,불친절합니다 돈까스 먹는데 느끼해서 짬뽕국물 조금만 달라니까안줍니다 결국 돈까스도 남기고 기분 상해서 다시는 안갈거임
3,년대에 생긴 역사가 오래된 양주시의 중국집 훌륭한거 같네요
3,깐풍기 탕수육 등이 훌륭했던거 같아요 년 전통 
3,짬뽕 좋았었음 장흥 가면 들리세요
3,깐풍새우 양장피 팔보채 군만두 유산슬 만족스러웠었음
3,완전 천연재료를 써서 만드는 피자가 특징인곳 근데 어쩜 맛은 이리 맛있는지
3,매운탕에 국수를 넣어먹는 독특한맛집 칼칼하고 매운맛이 돋보이던 곳
3,좋은 맛이었던 거 같다
4,년 전토의 중국집 양주에서 유명한 곳 가볼만햇다
3,뜃들도 있어서 식사후 차 한잔 하거나 걷기 좋더라구요 생선구이 드시러 가보세요
3,생선구이로 유명한집 여기 되게 플레이팅이 이쁘고 그릇도 완전 이쁨 먹을때 더 맛있게 느껴지는거 같아요
3,고추잡채 깐풍기 탕수육 등이 먹을만한 것 같네요
3,피자뿐만 아니라 떡복이로 만든 파스타랑 피자돈가스등 다른 메뉴도 다양합니다
3,합성재료를 전혀 쓰지 않는다고 하네요 더 건강하게 먹을수 있는거 같아요
3,제일 덜맵게먹어도 땀뻘뻘흘리면서 먹게됩니다  중독성있는게 한달에한번 꼬박생각날듯 
3,매운탕속에 생선못지않게 수제비와 국수도 듬뿍있음 얼큰하고 약간걸쭉한맛이 매력적이에요
3,전복 능이 한방오리 대체로 맛나겠어요
3,그런대로 맛있었고요
3,밥을 가마솥에 장작불때어 지었다고 하더라구요 어쩐지 밥맛이 진짜 대박이였어요 
3,진흥관 짬뽕으로 장흥에서는 유명한데요 괜찮었어요
3,매운탕 가격치곤 꽤 높다생각했는데 먹어보니 그만한 값어치에요 진짜맛있었어요
3,짬뽕 좋구요 요동네에서는 소문난 집입니다
4,진흥관 짬뽕 좋았던 편이네요 추천합니다
3,여기 노래방이랑 족구 시설도 있다고 하던데 그래서 단체모임하기도 좋다그러더라구요 가격도 괜찮구요
4,추천해요 년 이상된 중국집입니다
3,기본찬으롴돼지껍데기는또첨먹어보넼은근별미가많았던기억이남
3,진짜 먹고싶을만했다
4,짬뽕 맛있구요 꼭 드셔 보시길
3,모듬생선구이를 시키면 각종 생선구이가 나오는데 정말 짱임 생선구이 좋아하시는 여긴천국
3,참게장백반 대애애애박 참게장 맛이 진짜 훌륭하네요 밥도 뭔가 되게 맛있고
3,진짜 또 가고 싶은 맘이에요
5,가격도저렴하고맛도 정말최고인것같아요 직원도 너무친절하더라구요 왼쪽팔에문신있는여성직원 너무친절하셔서 좋았어요 주년기념 이라고집에가려는데불고기를싸주시더라고요 정말 최고었습니다 맛집강추입니다
4,대체로 음식이 괜찬나요 맛나겠음
3,훌륭했던 편이에요 진흥관 짬뽕으로 장흥에서는 유명
3,맘에 들었구요
3,짬뽕 괜찮았어요 장흥 맛집
3,추천할만햇던 것 같구요
3,또 갈려고요
4,진흥관 짬뽕 입맛에 맞았음
3,먹을만했습니다
3,진짜 먹을만한 편이에요
4,장흥 근처에서는 갈만해요
4,중국음식으로 여기 추천할만했어요
3,진짜 갈만했구요
3,맘에 들었다
3,괜찮었어요
3,진흥관 짬뽕이 깔끔해요
3,갈만했었음
4,가격이 저렴해서 사람들이 많이 찾는 곳으로 상차림비가 있지만 기본 찬도 깔끔하게 잘 나와요
3,스파게티 아주 깔끔한 거 같다
3,진흙구이 깔끔할 것 같아요
3,순대모듬 입맛에 맞았음
3,그럭저럭 입맛에 맞았던 편이네요
3,정말 맘에 들었던거 같아요
3,또 가고싶은 편이에요
5,돼지갈비만 먹다가 소갈비 먹으니까 신세계네요
4,외국인 친구가 집에 놀러와서 간곳 친구도 나도 만족스런 식사였음
5,친절한 직원분들과 알찬 갈비구이 까지  맘에 드네요 여기
3,먹을만했던거 같습니당
4,메뉴가 많지 않아서 더 좋아요 원래 맛집은 몇 가지 요리로만 승부를 보잖아요 친절하고 양도 많고 비빔막국수는 새콤한게 입가심으로 딱
3,만두가 담백하고 속이 꽉 차있어서 전골 국물이 굉장히 시원함 그 다음엔 메밀 칼국수로 마무리하면 밥을 제대로 때린것
5,엄선한 질 좋은 고기를 년 전통 레시피에 따라 한 치의 오차 없이 맛있게 양념 했다고 하네요
5,수육 잡내가 하나도 안나요  백김치에 싸서 무말랭이랑 먹는데 너무 끝내줘서 미간이 다 찌푸려지는 맛
5,서비스로 나오는 건 쫄깃한 메밀부침개가 다 해머금 얇고 바삭하고 
4,또가고 싶어지는 그런 곳이네요
3,진짜 먹을만 했던 것 같구요
5,의정부에서 멀지않은 곳에 있는데 도시에서 먹는 장어보다 훨씬 느낌있어요  그리고 여기 김치가 너무 맛있어서 포장해가고싶을 정도 였어요 저녁엔 사람이 많아서 사장님께서 잘 챙겨주시질 못하시더라구요 그래도 맛있으니까 만죡
3,맘에 드는 편이네요
4,장소가 좀 열악하긴 한데 놀러와서 먹는 느낌 비올때먹으면 더 좋아요 
4,식당이 크고 넓은 곳으로 평양냉면 하면 생각 나는 곳
3,대체로 깔끔했습니다
3,정말 또 가고 싶당
3,추천할만했던거 같다
3,동치미국수 정말 먹고싶을만했구요
3,갈만했다
4,가격대비 괜찮은 곳이라고 생각해요
5,전에 고기먹어서 이번에는 갈비탕먹었는데 담백하고 맛있네용
3,맛있었었던 거 같구요
3,그럭저럭 훌륭한 것 같아요
4,밑반찬도 깔끔하고 숯불향도 좋고 소스도 자극적이지 않아서 좋았음
3,돼지떡갈비 깔끔했었던 편이에요
2,숯불닭갈비엔 그닥 맞지않았던 기본반찬들 닭갈비 맛이나 직원도 친절바깥경치는 좋았지만 플랜카드에적힌 인정식 원은 점심특선이라며인저녁을 먹은 우리에겐 너무나 터무니 없었던 가격덕에 기분좋게 먹고도 찜찜한 닭한마리에만원
4,숯불에 고기를 올려서 굽기 때문에 숯불향이 솔솔하네요 
5,직원분들이 미리미리 준비하시고 계시다가 고기를 숯불에 올려서 구워주세요
3,두부보쌈 추천할만한 것 같구요
4,고기가 구워질때 스며든 양면이 바짝 익기 전에 베어서 부드러움속에 양념 잘 베어있어서 맛있었음
4,직원분께서 고기 잘라주시자마자 폭풍 흡입한것같아요
5,갈비 한점먹으면 맛있고 부드럽고 입에서 녹아요잉
5,그전 먹었던 갈비들과 비교했을때 월등히 맛있네요
3,모둠생선구이 만족했습니다
3,갈만했던거 같아요
3,그냥 가볼만했던거 같네요
3,맘에 들어요
3,도토리토속보쌈 만족했던거 같아요
3,버섯전골 아주 괜찮습니다
3,그럭저럭 만족할만한 편입니다
3,버섯전골 입맛에 맞았던 편이에요
3,좋은 맛
3,연잎오리진흙구이 진짜 훌륭한 것 같아요
3,무난한 맛
3,맘에 들었었어요
3,가볼만한 편이에요
3,돈까스 그냥 먹을만했습니다
3,그런대로 맛있었었던 거 같구요
3,전복 능이 백숙 진짜 좋은거 같아요
3,깔끔한 편이에요
3,버섯전골 좋은거 같아요
3,대체로 훌륭한 편이네요
4,북유럽 같은 독특하고 모던한 인테리어가 눈에 들어왔어요 소금대신 해산물 짠맛으로 간을하시고 설탕대신 과일이랑 결정과당 사용하신대요 그리고 휘바 안에 농장에서 수확한 채소로 조리한다고 하시더라구요
3,두부보쌈 정말 좋았었음
3,돼지목살스테이크 맘에 드는 편이네요
3,또 가고 싶습니당
4,주차장자리도 많고 맛도 좋았던 곳이였어요
3,또 가고 싶습니당
4,집근처여서 지나 다니다가 자주 봐오던 곳이라 금방 찾아던것 같아
3,추천할만한 것 같다
5,신관이랑 구관이있는데 사람이 진짜 많나보다아
5,갈비는 인분에 대가 나오는데 양이 많아요 갈비살은 도라지랑 같이 구워 먹는데  진짜 맛있어요
3,추천할만했음
3,여긴 정말 강추입니다
5,신선한 한우육회에 배랑 무순이랑 같이 한입 먹으니까 정말 행복했어요
4,여기 밑반찬 너무 맘에 들어요  특히나 해초 샐러드 겨자 소스에 머무려 주는데 짱맛
5,갈비에 저민 소스도 달짝지근해서 잘 베어있어 맛있었음
5,부추전에 밀가루가 거의 보이지 않을만큼 여태먹던 부추전과는 확연히 달랐어요 부추국수도 맛있고 가격도 저렴하고
3,그럭저럭 먹을만했던 편이에요
5,갈비먹고 된장찌개먹고 냉면먹고 먹방찍은날임
3,칼국수 그럭저럭 먹을만 했던 것 같구요
3,훈제오리호박구이 진짜 깔끔합니다
4,가격대비 괜찮았어요
5,숯불에 구운 고기맛이 최고네요 서비스 또한 좋구요
3,여긴 정말 포기할수 없는 맛집이에요
3,돼지목살스테이크 맛있는 편이네요
3,가볼만했던 것 같아요
3,두부전골 맘에 든 것 같아요
3,진짜 또 가고 싶은 것 같아요
4,본점과 다르게 여기는 숯불에 고기를 구워서 먹을수 있어서 좋았음
3,부추전 정말 맘에 들음
3,맘에 들었다
4,갈비탕 좋다
3,비빔국수 대체로 깔끔하다
4,고기를 구워주시고 반찬이 떨어지면 그때그때 마다 바로 가져다주세요 직원분들이 친절하셔서 좋았어요
4,여기는 서비스가 이때까지 가본 고깃집 중에서 가장 맘에 들었음
3,여러모로 좋아요
3,정말 먹고싶었음
3,해물칼국시 먹을만 했던거 같다
3,추천할만한거 같구요
3,샐러드 맘에 들었어요
3,진짜 갈만했었어요
3,입맛에 맞는 것 같네요
4,갈비탕 진짜 맛있다는데요
3,두부보쌈 괜찮았던 편이에용
5,힐링캠프 윤여정씨 편 촬영장소라고 하네요 신식 한옥건물이 진짜로 멋지고 마음에 들었습니다 기대하고 가긴 했는데 진짜로 생각외로 엄청 컸어요 
5,데이트코스로 좋은것 같습니다 층 테라스나 층 왠지 리조트에 온 것 같은 분위기라서 건물도 굉장히 맘에 들었어요 자연경관이 진짜로 너무 멋있었던 카페였어요
5,비빔막국수 먹었는데 진짜 맛있었어요 그리고 떡만두국 안에 만두모양 특이해서 인상깊었음 
4,갈비탕 대체로 맛있는 편이에용
3,오래오래 생각나는 맛입니다
3,가볼만했엇어요
3,그냥 무난무난해요
2,도토리만두 맛나겠어요
3,토종닭한방백숙 맘에 들었었어요
3,아주 만족스러워요
4,훌륭했었음
4,닭백숙 오리백숙 여러모로 괜찮았습니다
4,너도 나도 우리 모두 가보고 싶어할 만한 곳입니다
3,맛있었었던 것 같구요
4,갈비탕 먹고싶을만했었음
3,나쁘지는 않지만 맛집 까지는 아닌듯
3,깔끔한 것 같네요
3,친구들이 맛있다고 추천해서 가봤는데 가격도 적당하고 괜찮았어요 추천
3,여러모로 괜찮았음
3,평타는 쳐요
3,갈데 없으면 가보셈
3,부추전 먹을만했던거 같습니당
4,좋았던 것 같다
3,여러모로 괜찮았음
3,동네에 있어서 가끔 가요
4,여럿이 같이 갔는데 반응이 나뉘더라구요
3,격하게 아끼는 곳
4,꽤 괜찮았습니다
4,아주 좋았다
4,간만에 모인 식구들 하궁 송추 가마골에 욌어욤  얼른얼른 익어랑 향기 넘 좋다잉  감사히 잘 먹겠습니다 
4,가마골갈비 그런대로 맛있다는데요
3,그냥 갈만했었구요
3,괜찮은 것 같다
3,깔끔했던 편이에요
3,대체로 깔끔했음
3,좋았던 편이에요
3,리코타치즈와 가지구이를 얹은 샐러드 맛있었던 편이네요
