star_score,reviews
2,요즘 트렌드에 맞게 리뉴얼 하신듯 
3,층이 창있고 거울있는 쪽이 포토존이에요
2,대구에는 핫플레이스가 자꾸자꾸 생기는 중
2,아몬드 모카 비엔나 부드럽고 괜찮았어요 
4,매장은 골목 안으로 들어가야 나옵니다 
3,그린티 스콘안에 견과류랑 팥도 들어있어요 
2,뽀로리 라떼 먹고싶은데 
2,스콘이 크기도 큼직하고 다 먹어보고 싶음 
2,규모가 막 크지 않은데 아담하고 좋네요 
3,매장이 아주 크진 않은데 너무 작은 곳 아니고 깔끔함
2,대부분 버거랑 펜네랑 시키는것 같았어요 
2,레몬진저라떼 크림에 레몬조각 들어있어서 계란 같아요 
3,맛도좋아요
2,먹을만 하고 깔끔하게 잘나와서인지 벌써 인기 
3,여기 장점은 넓다는 것
2,까페가 정말 작아요 명 이상이 같이 가긴 무리 
3,요즘 유행하는 심플한 인테리어 까페
2,앞이 탁 트여서 개방감 있고 좋네요
2,위로 올라가면 소파석도 있어요
5,분식집 우동국물의 교과서 오랜만에 제대로 된 국물을 맛보았고 김밥도 밥부터 재료까지 훌륭했습니다 쫄면도 좋았지만 매운 맛을 찾으신다면 맵게 해달라고 따로 요청하셔야 할 듯
2,아직 가오픈기간이라서 층은 아직 준비중
3,저번에 대구 왔을때 에서 완전 핫 한 딸기식빵 먹으려다가 다 떨어져서 먹지못했다 그런데 이번에 지나가는 길에 혹시나 싶어서 들렸는데 어랏  있네  만족했던거 같아요
5, 에서 딸기식빵 영상으로 유명해진 곳 좋았던거 같아요
2,우연히 지나가다가 사람들이 엄청 줄을 길게 서있는 거예요 뭔가 맛집이라는 직감이 왔죠 맛있는 양념 냄새도 솔솔좋은 맛이었어요
4,가격 저렴하고 친절합니다 짬뽕이랑 탕수육을 먹었는데 짬뽕은 요즘 유행하는 불맛이 아니라 옛날식 시원한 국물이라 해장에 좋을 것 같고 탕수육은 약간의 잡내가 나는 것 말고는 만족했습니다 가성비 생각하면 강추합니다
3,직원분들이 정말 너무 친절하셔서 가오픈인데도 너무나 잘 먹고 왔습니다 스테이크도 파스타도 괜춘 기분 좋았던 곳
1,없어졌습니다
3,스테이크가 정말 맛있었어요 최고
5,가게 이름도 바뀌고 바지락은 이제 안 팔아요  칼국수 전문이네요 
3,요즘 유행하는 인테리어 취향저격
5,골목안에 있어서 네비로 찾기도 어려워서 동네분에게 물어서 갔지만 맛집찾는기분이 남 식전 육수가 구수했음  뜨거우니 조심 물냉 비빔냉 한우수육 먹음  어머니가 고기도 괜찮고 좋아하심 잘먹었습니다
3,바나나 퐁당 이름이 너무 귀여워서 심장폭격 근데 달고 맛있어서 심장에 무리가 흑  맛있어여 
2,먹을만한 편
2,원 이상 배달되요
3,맛이 괜찮은데 양이 좀적음 둘이세개 해도될듯
3,친구가 카페로도 이용가능하다고 해서 갔는데 커피와 디저트도 평타 이상 밥을 먹고 카페까지 이용할 수 있는 곳이라 좋았다 나중에 소개팅으로도 좋을 듯
3,가게에 항상 사람이 많은 편
3,소파석도 있고 분위기 좋아요
2,깔끔해서 친구랑 오기 좋음
3,주인분 두분 친절해서 좋았음
2,늦게까지 해서 좋음
3,정식오픈한지 얼마 안된곳
2,수박롤케잌 예쁜만큼 맛잇습니당
2,반반반 세트 주로 배달 시켜 먹는 곳
2,생각보다 별로 크지가 않음
4,재미있따  가끔 눈팅하는거도  그냥  다 내잘못이고  다  내탓이다 더운데 열올리지말자 
3,동전 초콜릿이 나와요
2,마카롱에는 선인장이 그려져 있음
2,오후에 갔는데 사람이 많았음
3,층은 거의 카운터고 층에 올라가요
1,메뉴판에 알몽무게 등심돈까스 이라고 되어있길래 직접 재어보았죠 돼지고기 빵가루합계 더웃긴건 더블돈까스는 이라는데 계산이 안맞죠  음식으로 장난치면 안되죠 저녁시간 우연히 소스 만드시는것 봤는데 데미그라스시판돈까스소스토마토페이스트닭고기맛시즈닝 을 섞더라구요 시즈닝은 후라이드치킨에 쓰는건데 돈까스소스를 직접 만들지 못하는가보더라구요
3,먹을만 했던 것 같다 늦은 시간에 가면 인기있는 빵들은 없을때가 많다
4,생고기하면 송학구이 맛납니닷
3,동네에서 치맥하러 가는 곳
3,크로와상으로 유명한 곳
3,크림들어간 크로와상 짱 맛있음
3,층은 안쓰는것 같았어요
2,혼자 먹기에도 좋은 곳
3,벌써부터 인스타 핫플
4,내일 한시간 남았따 귀 빠진날이다 
3,에그 베네디트 완전 맛있습니다
3,테이블 간격이 여유로워서 좋음
2,수박주스 있어서 시켜먹음
2,애들이랑 가족식사하기도 괜찮아요
2,너무 더워서 테라스는 못가봄
3,추천할만햇던 것 같다 대구 시티즌들에게 하태하태 
3,층은 단체석 하나랑 테라스
2,분위기가굉장히 좋아써여
3,에그베네딕트  비주얼도 예쁘고 수란 톡 터질때 그  행복함이란
2,밀쉐를 주시니 감자튀김을콕 냠
3,빙수 사진으로만보다가 직접봤는게 너무귀여워요
2,담에또갈거에요
3,요즘 꽤 자주 가는 집인데 브런치 파스타 음료 다양하게 먹어봤는데 빵은 이번에 첨 먹어봤는데 먹물빵인가 그거 엄청 고소하니 맛있더라구요
3,치즈까스 치즈 많이 들어있음
4,홍합의 선선한 맛과 밑반찬의 깔끔함이 참좋네요
3,매콤해서 질리지 않는 맛
2,여기 점점 인기가 많아지는 듯한 느낌
3,하필 쉬는날가서  담에 갈게요
3,단조롭구나
5,아주 괜찮았어요 추천합니다
3,쪼끔비싼데괜춘
3,폭염이라는데 맛탱이 갔는건 이해함 
3,온통 하얀색 하얀색 같은 공간
2,먹물파스타는 오징어안에 크림소스 들어있음
3,작은 골목으로 들어가야 매장이 나와요
2,그냥 까페처럼 이용해도 되고 식사해도 되는 곳
3,케익도 전부 수제라 맛있음
2,브런치도 되고 저녁에 가면 예쁜 바
3,브런치 먹으러 갔다가 런치 시간에 먹게 됐지만 맛있었어요
3,최근 동성로에서 가장 핫한 집인듯 예쁘고 맛있고 두루두루 다 갖춘 맛집인듯
3,또 가고 싶어요 층까지매장있어서 넓네영
3,디저트류도 맛있고 카페도 괜찮음 일단 뭐니뭐니해도 분위기가 받쳐주니까 다 맛있게 느껴짐
2,옥상에서 사진 많이 찍는것 같았어요
2,함박안에 치즈 들어있는데 감동
3,반숙계란이랑 소스랑 함박이랑 잘어울림
3,직접 다져서 만든 함박이라 되게 부드러움
3,녹차빙수는 견과류가 따로 포장되서 나와서 뿌려먹음
5,대구의 일본라멘집 중 돈고츠 계열에서는 가장 잘함 장점은 자가제면과 육수 생성을 매장 내에서 하기 때문에 맛의 일관성이 있으며 가장 기본적인 시로가 안정적으로 메뉴에 자리 잡았다는 점 최근에 메뉴 생성과 매장 내 인테리어 변화로 변하는 중이라 어떻게 맛을 만들어갈 지 기대하게 함 아쉬운 점은 구루메 계열 느낌의 다소 밋밋한 점을 마유 등으로 임펙트를 주는 구마모토 풍으로 기본 시로 메뉴의 선택폭이 좀 더 업글되어도 좋을 듯
3,가오픈 기간에도 인기 많았던 곳
2,저렴한데 제대로된 함박
3,또 가고 싶음진심 맛있음
2,녹차 빙수말고도 딸기나 망고 빙수도 다 괜찮은 편
2,꽤 넓고 사진을 어디서 찍어도 예쁘게 나오는 곳
2,일단 음식이 맛있고 분위기도 괜찮음
2,루프탑은 저녁에 가도 분위기가 좋음
5,별내리시는게 별루녜요 우동은 학관 학식 같은  안습 쫄면은 인천 신신 분식이 더 맛있구요 서울 경인 지역에서 먹어보지 못했던 색다른 쫄면이라 맛나게 먹긴 했네요 김밥은 음 연희동 연희김밥이 작살 절단나여 여기 김밥은 오이가 없는게 좀 아쉽네요
5,인정 비빔냉면이 더 맛있네요 물냉밖에 안먹는 사람인데 희한하게 비냉이 맛있네요
5,우옹오오옹 군만두 진짜 절단 난다  진짜 와 여기는 군만두 드셔야 합니다 속이 꽉꽉 찬 육즙 가득한 고기가 피 안에 한가득 군만두라고 피가 두꺼울거라구요 천만의 말씀 만만의 콩떡 피도 바싹하고 엄청 얇네요 곧장 고기가 튀어나오네 식슐래 별 개 주시죠
5,여기 식슐랭 별개 주시죠 진짜 말도 안되게 맛있는   압구정 변강쇠 떡뽁이 보다 질도 좋고 훨씬 맛있네요 매운거만 먹으면 땀샘 폭발하는 저인데 땀도 별로 안나고 색감에 비해 별로 안매운 마약 국물  납작만두는 그냥 작살이네요 순대는 간보다 허파가 아름다워
3,대구에 있는 멕시코요리중 괜찮은 편인것가타여 치미창가 굿
2,종류도 다양하고 무엇보다 맛있어서 매우 좋아한답니다 맛있다고 유명한 빵집답게 빵이 맛있어서 또 가보았습니다 좋아요
3,비오는날 실내에서 야외 정원 바라보면서 맥주 한잔 하면 진짜 분위기 최고에요
2,전혀 카페가 있을 것 같지 않은 곳에 있어서 놀랐어요 곰탕라떼 수박롤 특이한데 생각보다 훨씬 맛있었네요
2,왠지 잔인한곰탕라떼 너무귀여웟
3,동성로 최고 핫플레이스
2,층 테라스석이 제일 인기석이에요
3,대봉동에도 루시드 까페 생겼어요
5,년 대구살았어도 최근에 첨 알게 된 곳 주위 친인척 친구들에게 물어도 아무도 모름 대부터 동성로를 이잡듯 다녔는데 왜 몰랐을까 근데 맛은 있더라
3,야시장 조금남다른리어카 갓엇는데 메론빙수도 맛잇구 사장님도 친절하시구 좋앗어여
3,가게는 작지만 맛집의 포스가 풍기는 곳
2,분위기도 좋고 여자분들이 좋아할만한 곳
2,청포도케이크가 맛잇엇어용
4,고기가 부드러워요 맛 자체는 그냥 깔끔하다 막 찐한 맛은 아니에요 초행인 사람은 자칫 간판 못 보고 지나갈지도
4,솔직히 외내관은 오래된만큼 좀 허술해요 다른 면 종류는 그저그랬지만 달짝한 쫄면이 납작만두랑 잘 어울립니다 다른 분들 말대로 소도 거의 없는 만두뭔맛으로 먹나 싶었는데 매콤한 맛과 합쳐져야 완성되는 맛 같아요 자주 먹진 않고 한 번씩 생각나는 맛
3,브리또 맛있어요
3,갈만한 편이에요
3,여기 양도 많고 맛있음
2,찰스 외관만 보고 젊은녀석들이 곱창을 맛있게 하겠어 라는 의구심이 들수도 있어요맛있는 편이에요
3,년 경력의 화상 중국집으로 여러가지 짬뽕이 아주 괜찮은 것 같아요 그중에서 특히 냉짬뽕은 아주 독특하다 고추짬뽕과 꽃게짬뽕도 있다
3,빨간 양념의 닭다리살 추천
3,동성로에서 완전 핫한 곳
3,불고기 양 꽤 많음
3,대구의 대표음식중에 하나인 찜갈비를 전문으로 하는 곳이다 고춧가루를 사용하여 냄비에 볶아 나오는 찜갈비가 맛이 좋다
3,고기도 부드럽고 떡도 쫄깃함
2,메뉴가 식상하지 않고 좋네요
3,줄서서 기다려서 사가는 곳
3,연탄구이 냄새 확 남
3,아저씨 두분이서 하는데 다른집보다 여기가 좋음
3,생갈빗살을 질좋은 숯불에 구워 먹는 맛이 좋은 맛이었던 것 같아요
3,화교가 운영하는 전통 중식당으로 매운짬뽕이 아주 유명한 곳이다 닭뼈로 낸 국물 맛이 일품이다
3,인생브리또 전 닭고기가 좋아서 닭고기로만 먹지만 다른고기들도 차차먹어보께용
3,기본적으로 양념이 맛있어요
2,내부 어둡고 친구들이랑 모이기 좋은 곳
3,매장이 꽤 넓은데도 웨이팅이 길게 있었어요
3,사장님 친절하고 맛있어요
3,전메뉴 두루두루다 맛있어요
3,불고기랑 우동이랑 주문하면 되요
3,대구의 옛맛을 그리워 하는 사람들이 즐겨 찾는 곳
3,소주한잔 하기 좋은 집
2,애들도 잘먹네요
2,단골이 많은듯한 분위기였음
2,바지락 푸짐하게 들어간 칼국수
3,떡 치킨 말고 그냥 치킨만 주문하는게 더 좋음
2,찰스곱창이예요 대구사람이라면 다 좋아하실거예요
5,음식맛이 일품이네요
5,적극 추천합니다
3,국일따로국밥과 더불어 시내에서는 오래된 따로 국밥집 맛이 좋네요
2,음식이 전부 다 독특해요
5,이해할수없는집  이제는 정심시간에 줄안서도됨 약발떨어졌나
3,솔직히 납작만두 뭐먹을거있냐곸대구여행가서 이거먹는사람이해안됬는뎈직접먹고나니 내가틀렸음 미친 꼭먹어야함떡볶이랑 같이
3,추억의치킨맛을 제대로내는 원주 요새 자극적인맛이 널린지라 어릴떄 아빠가사오던 통닭같은 순수함이 그리워질떄 들리곤해요  양도푸짐해서 둘이서 한마리먹지도못함
3,추억이떠오르는 돈까스맛  경양식이라 더 부담없이먹기좋았어요 고기두께도 생각외로 두툼해서 양이 꽤 많더라구요 
3,어느한건물내부에위치해있는데무척찾기난감한게아쉽네요그래도돈까스맛하나는인정합니다밝은곳에위치했었다면줄서서먹을정도로인기가많아질듯
3,하나삼송가고싶어진다리얼 옥수수빵개미친맛임 오픈전부터줄서있어서 서울올라가기전에 살수있을까 걱정헀는데아 미친 대충고른게넘후회되 한만원치샀어야되
3,시카고피자가 맛있다는데 피자보단 개인적으론 파스타류나 빠에야 추천함 솔직히 시카고 한조각도먹기힘듬치즈를안좋아하는인반면에 빠에야나 파스타는 인 그릇도 가능할정도로 개존맛
3,막창에본거지라그런지 가격이정말저렴했어요 막창외에 다른부위도 불판에올려서 같이구워먹던데 이름은기억이안나도 막창처럼 정말맛있었어요
3,부산갈필요없이 대구에서 씨앗호떡까지 한방에 해결하게되네요  빵같이부드러운 호떡피가 고소한 속내용물과 잘어울려서 평범한 호떡보다 더맛있었어요
3,만두를가지고 온갖메뉴를만들어놔서 메뉴선택부터 뭘먹어야할지고민임 지금까지 탕수만두랑 군만두 비빔만두먹어봤는데 아직도 한참먹어봐야할게 많이남아있음 
3,대구에서 박일 여행동안 저녁은 꼭 연탄불고기에 소주로 마무리졌음와 진짜 연탄불고기개존맛이다 가격도개저렴함
3,신랑 출장에 쫄쫄따라가서 가보고싶었떤 맛집 출석완료  떡볶이는 먹어도먹어도 질리지가않아서 큰일이에욤대구맛집도 클리어
3,김밥이유명하대섴혼자먹는내내구경해봤는데 진짜 매장손님도 끊임없이들어오는데다가 포장도 오지게나가더라 나도 분위기휩쓸려서 포장해옴
3,집에먹을거없을떄 자주시켜먹는데넼 매장에서먹는것도맛있긴한데 집밖에나가기귀찮다보니 
3,다른지역에도 여러 체인점식으로되어있어욤예전에 먹어봤던곳이었는데 대구가 본점이었다닠여기는 갈비묵구나서 볶음밥꼭먹어봐야함
3,골목에 위치한 작은맛집 대구여행때 친한오빠손에 이끌려간 곳이라 정확한 위치는기억이안나요  추어탕을 이때처음먹어봤는데 넘넘맛있었어요
3,일하다스트레스받아서 반차내곸친동생이랑 스트레스박살내러옴 기본적으로 매콤한떡볶이인뎈일부러 맵게해달라고 부탁드려서 퍽퍽먹음
3,백화점구경하다가 배고프면 원조로 고고싱백화점안에 먹을것도별로없고 다비싼지라걍 원조가 짱임
3,냉면메뉴속에도 함흥식과 평양식 둘로나뉘어져있어요 사실 북쪽냉면맛이 무슨차이인지 아직도 잘모르겠어요 그저 삼삼한맛에 먹게되는지라 
3,대구시내는 어느곳이든 웨이팅이기본인것같아요 흔하디흔한 떡볶이 납작만두곰탕 같은거말고 일본식 가정식도 꽤 괜찮네요 
3,대구에서오래된노포식당담백하면서도칼칼한육게장맛이일품인맛집노포식당이기에청결함을추구하시는분들이라면고민하시는게나을듯합니다보기싫을정도로지저분하진않지만세월이있기에연식이느껴집니다
3,한상으로 먹기엔 가벼운주머니사정은아니지만한식의미를 이처럼 아름답게담아낸맛집은 본적이없다 먹기아까울정도로 정갈하던 음식들 기회가된다면 고민없이 먹으러올듯
3,거의 년이 다되어가는 오래된 맛집 어릴때부터 엄마손잡고와서 먹었는데 조만간 제가 아이손잡고 오게되겠네요 임신해도 입덧없이먹을수있었어요
3,월배 이마트 뒤편에 있어요
4,이런 리더가 되어야징
2,바지락이 많아서 바지락탕에 칼국수 넣은 느낌
3,유명한 곳이에요 바지락신선하고 시원함
5,여긴 년 넘었어요 단골임 음료수 챙겨주시고 짱
4,여긴 맛보다 추억 
4,맛있음 
3,그냥그냥 어쩌다 한 번 갈만한 곳
2,김밥만 먹어봤는데 별로
5,굳 완전 맛있음
3,돼지불고기와 돼지갈비가 인기 잇지만 고추장 불고기가 제일 맛있는 거 같아요
3,년 역사를 자랑하는 곳입니다
1,맛을떠나서 손님 눈치와 차림새 봐가면서 반찬갯수 양 조절하고 밥먹는데 한쪽 구석에서 서빙아줌마들이 수다떨어가미 손님들 입안에 음식들어가는 식사하는 얼굴만 뚫어지게 쳐다보는건 이 집이 최고군 주인장과 맛은 좋와도 다시는 안가게되는 첫느낌을 받음
5,두 그릇 시켜 먹고 포장해 온다는 얼갈이 배추로 승부 김치도 너무 맛나고 고택에서 독상받아 식사하는 기분
4,느므느므 매웠던 기억이 나중엔 머리를 치며 먹었다는 한번즘은 도전해볼만
4,특이한 비빔우동 김밥 우동 맛나요 별로 드간거도 없는데 희안해
4,시원하면서 뒷맛이 달다 양파인지 무우인지 맛있다
4,납짝만두 첨엔 야 장난치냐 이게 만두냐 근데 고소한 맛에 자꾸만 손이 간다 떡뽁이 양념이랑 먹으면 찰떡궁합 옆으로만 앉는다는
4,요로코롬
3,군데 식당이 모여 있는데 이집이 가장 인기가 많은 곳이다
5,옛날 돈까스 좋아하시는 분 꼭 가보세요 튀김옷은 얇고 고기가 아주 두터워서 씹는 맛도 일품이고 옛날 돈까스 소스가 정말 맛있습니다
3,년전통의 역사를 가진고깃집  연탄불에 구운 돼지고기가 일품이다 만족할만한 편입니다
3,부창생갈비 고기가 맛있네요 년 전통의 생갈비 집입니다
3,먹고남은 갈비뼈를 넣고 끓여 먹는 된장찌개도 좋아요
4,차 살려고 알아보는중 보게된차 이쁘네이
3,백종원의 삼대천왕에 나온 대구 동성로 중앙떡볶이 기다린시간에 비해 기대한것에 비해 맛은 보통 개인적으로 밀떡을 더 좋아해서 다른 떡볶이랑다르게 맛이 덜 느껴져서 좋았고 김밥도 맛보고 싶었지만 김밥이 다 판매되서 순대랑 떡볶이만저 납작만두는 맛있어용 구워서 그런지 군고구마맛도나구용 생각보다 양도꽤되서 굳이 일인분씩안시키고 여러명이가서 조금시켜서 나눠먹어도 좋을듯해용
3,처음 먹었을땐 그저 그랬는데 계속 먹으니까 담백한게 고기맛도 많이 나고 맛있어요 크기가 생각보다 크더라고요 단점은 가격에 비해 살짝 비싸요
5,주차도 편하고 양도 푸짐하더군요 잘 먹고 갑니다
5,맛있어요가족과함께 좋아요
1,예전에는 맛있었는데 최근에 갔다가 완전실망 내가 만들어도 이것보다는 맛있겠다는 생각이 들정도였어요 저희집 가족들 입맛에는 이제 아웃인집
4,납작만두는 쫄면과 찰떡궁합 잘 비벼서 만두에 싸 먹거나 쫄면한입 만두한입 먹으면 배부르고 좋아요  대구 곳곳에 체인점이있다 하네요
4,생각보다 크지 않아서 그냥 지나칠뻔 했어요 마약빵으로 불리는 옥수수빵이 제일 유명해요 이빵 찾느라 두리번거리면 마약빵 찾냐고 물어봅니다 윗면은 콘스타치 때문에 달달하고 속은 옥수수알이 탱글거리고 워낙에 빨리 팔려서 항상 따끈한 빵을 먹을 수 있는 듯해요 
5,중독성이 강하죠 첨 먹는사람들은 뭔맛으로 먹나 하겟지만 맛들이면 자꾸 생각나요
4,마지막 씨스터 시험 잘보고 오니라 수능보시는분들 대박 나시길 대구는 비오네요
5,정말맛있다머어보면안다
4,아오 사랑니야 내일 꼭 대학병원에서 뽑아야겠따
5,국민학교 다닐때 있던곳이 아직까지 대구 대통닭 딱 옛날맛 그대로 입니다 강추 합니다
4,계속해서 더 시켜먹게 되요
3,백종원 대천왕에 나오면서 인기가 정말 많아졎다 지금을 줄을 서야하고 급기야 재료가 떨어져서 못먹고 돌아갈수도 있다
5,대구에서 유명한 돈까스 맛집
4,예전에 비싸진가격이 맘에안들지만  너무맛잇어요  만두랑 비빔밥의 환상의궁합 육회추천할게요 
4,년 된 깊은역사가 있는 빵집이죠 프렌차이즈가 판치는이때 최고의빵집같습니다
3,소막창이정말맛있었습니다 소박한가게에서 먹으니굿
3,돈까스가 맛있는 집입니다
4,맛은 있어요 동대구역 삼송은 알바생들이 별로입니다 손님와도 그많은알바명중 아무도 안움직입니다 계산대에서 빵 있는지 물어보려 서있어도 아무도 관심가지지않고 배달온 치킨집 아저씨에게만 달려가더군요 불러도 대답없이 치킨만바라보는 모든 알바생들이 참 밥안먹이고일을시키는지알바비를 제대로안주는지이런일이 동대구역에서만번째입니다 동대구역 점 만 이러네요
3,골목 곳곳에 할매국밥냄새가 진동을하니 배가불러도 배가고픈기분 
4,갈비찜 맘에 들었었어요
5,대구 대 냉면집이라는 대동면옥 골목길 안에 입구가 나있는데 물냉면이 진짜 담백하고 맛있었어요 흔한맛이 아니라서 더 깔끔했고 들어간게 많지않은데도 시원하고 국물이 살아있는 기분좋게 쌍란이 딱나왔네요
4,메뉴들도 괜찮고 가게 인테리어도 넓고좋구요 후식 세번 다 리필채워서 먹었어요 기억은 잘안나지만 케이크랑 프라페먹은 것 같네요 가볍게 찾기좋은 레스토랑
5,자꾸 생각나는 빵  괜히 마약빵이 아니네요 가격도 괜찮고 달콤짭짤한게 옛날빵맛인데 금방구워 나온것도 진짜 녹지만 식어도 맛있어요  쓰는 도중에도 먹고싶다
3,아는사람만 알법한 위치에있는 국밥집이에요 지나다니면서 자꾸 사람들이 이상한골목으로 자주들낙거려서 궁금해서왔더니 유명한맛집이더라구요
4,가격 바뀌엇어요 인당 원이구요 친절한 남자 직원분들 그리고 은근 양 적을거라고 생각햇는데 배불러용 의외로 고기는 별로였으나 다른 메뉴들이 더 맛있엇다는게 특이
4,씨온녀 적어도 신고 기능의 악용으로 사용이 안되면 클린하게 역겨운 사진올라오면 바로 필터링하여서 걸러내든지 지금까지도 신고한 당사자가 그놈의 역겨운 사진과 글을 봐야하는가 적어도 옮고 그름은 판단할수 있어야하는거 아닌가 밤새 그글은 일반인에게 필터링되고 나는 정의감 아닌 정의감으로 노닥 거리게 만드는것인가 씨온대표님 임직원 여러분 소환은 안걸테니 이거 보정해줘요 그대들이 막아논 신고 필터링이 재기능을 못하니께
4,그럭저럭 입맛에 맞는 편이에요
4,정말 갓 구워서 더 맛있는 북상로 연탄불고기 소주랑 우동이랑 최고다 비오는 날 다시 가야지
3,입맛에 맞아요
3,콩국에 튀긴인절미를 넣어줘서 신기하면서 맛있음
3,되게 옛스러운 멋이 있어서 좋았구 가격도 저렴해서 굳
4,따뜻할때먹어야 더 맛있습니다
4,대구에사는 대학동기가 추천한곳 대구도 솔직히 이거말고 먹을거많은데 곱창이나 치킨말고 이게 가성대비 훨 나았음
4,정말 피자 맛있더라구요피자가 작아서 양이 작겠구나 했는데 속에 정말 치즈 고구마가 꽉 차있어서 두명에서 하나먹고 배가 부를정도로 양이 어마어마했습니다
3,여기 고기 진짜 맛있다그래서 갔는데 진짜 맛있는데 학생에겐 비쌈
3,맛있었었던 것 같다
5,진짜 뻥안치고 먹어본 빵 중에서는 듭니다 빵 하나에 원이래서 좀 비싼거 아닌가 싶었는데 충분히 납득이 되는 가격
4,역시 맛나요   마약빵 짱 
3,뭉티기고긴가 접시채로들고 뒤집으면 안떨어지는고기 무튼 육사시미같으면서 다른 생고기파는덴데대박입에살살녹음
4,고소하고 속이 꽉찬 김밥 그 유명한 쫄면 쫄깃하고 맛있습니다
4,음식이 푸짐하게 나오는데 가격이랑 비슷한 양인것같아요 둘이서말고 여러명이서 가는거 추천 괴물빙수도 추천합니다 대프리카에서 살아남기위해서 큰빙수는 필수
3,진짜 오랜만에 갔는데 어릴때 추억도 먹고 고기도 먹고 좋았어요 한우불고기가 완전 밥도둑
4,쫄면이 간이 강했어요 저한테는 조금 달더라구요 근데 납작만두에 싸먹으면 딱이에요
